{
  "decision_id": "feedback-triage-kit-build-approval",
  "kit_id": "feedback-triage-kit",
  "kind": "build_approval",
  "requested_action": "Approve and run the medium Feedback Triage Kit.",
  "reason": "This is a newly generated kit and must be approved before execution.",
  "risk_level": "normal",
  "expected_result": "Askdo will run the kit and save FEEDBACK_TRIAGE.md and ACTION_TABLE.csv.",
  "affected_areas": ["askdo/kits/feedback-triage-kit/", "askdo/runs/feedback-triage-kit-20260602/"],
  "choices": [
    {"id": "approve_and_run", "label": "Approve and run", "effect": "Approve this kit and run it."},
    {"id": "revise_kit", "label": "Revise kit", "effect": "Revise before running."},
    {"id": "reject", "label": "Reject", "effect": "Do not run this kit."}
  ],
  "default_choice": "revise_kit",
  "status": "approved",
  "selected_choice": "approve_and_run",
  "decided_at": "2026-06-02T11:35:03.3824237+08:00"
}
