{
  "decision_id": "approve-askdo-project-review-20260601",
  "kit_id": "askdo-project-review",
  "kind": "build_approval",
  "requested_action": "Choose whether Askdo may run the Askdo project review kit.",
  "reason": "This kit was newly generated and Askdo rules require the user to choose the next step before execution.",
  "risk_level": "normal",
  "expected_result": "Askdo will run multi-dimensional simple, medium, and hard tests against this project, synthesize findings and optimization recommendations, then generate a Word document deliverable.",
  "affected_areas": [
    "D:\\TEST\\askdo",
    "askdo/runs/askdo-project-review-20260601/",
    "Word report deliverable generated through delivery processing"
  ],
  "choices": [
    {
      "id": "approve_and_run",
      "label": "Approve and run",
      "effect": "Move to the run step."
    },
    {
      "id": "revise_kit",
      "label": "Revise kit",
      "effect": "Stay in review and revise the kit or test plan first."
    },
    {
      "id": "reject",
      "label": "Reject",
      "effect": "Stop this kit from running."
    }
  ],
  "default_choice": "revise_kit",
  "status": "approved",
  "selected_choice": "approve_and_run",
  "decided_at": "2026-06-01T17:59:35.8865649+08:00"
}
